details,date,city,state,country,shape,summary,report_date,posted_date,image
https://nuforc.org/sighting/?id=161937,02/05/2021 21:00,Casa Grande,AZ,USA,Formation,Seen 2 bright lights in the sky shortly after there were 4 more they seemed to come towards the ground but did not land. I saw them ye,02/05/2021,03/02/2021,
https://nuforc.org/sighting/?id=161994,02/05/2021 20:30,Newark,OH,USA,Light,Several orange colored lights in the southern sky about 25 degrees above the horizon moving west to east. Lights clustered close togeth,02/09/2021,03/02/2021,
https://nuforc.org/sighting/?id=163479,02/05/2021 20:00,Napa,CA,USA,Light,Red light separates into two.,05/24/2021,07/31/2021,
https://nuforc.org/sighting/?id=161944,02/05/2021 19:00,Fort Worth,TX,USA,Oval,"Fleet of 20-40 ufos descended on house, stayed long enough for my family too see them, came way down and then left",02/06/2021,03/02/2021,
https://nuforc.org/sighting/?id=161940,02/05/2021 18:50,Tucson,AZ,USA,Orb,"Bight white object at orbital altitude, slowly moving, became gradually much smaller in size dimming to deep red disappeared .",02/05/2021,03/02/2021,
https://nuforc.org/sighting/?id=161938,02/05/2021 18:30,Hopkinsville,KY,USA,Light,Ball of light floating across the sky!,02/05/2021,03/02/2021,
https://nuforc.org/sighting/?id=162088,02/05/2021 11:28,,ON,Canada,,MADAR Node 113,02/17/2021,03/02/2021,
https://nuforc.org/sighting/?id=161931,02/05/2021 10:18,Cleveland,TN,USA,Orb,Blue Orb accidentally caught on camera darting through clouds SE Tennessee,02/06/2021,03/02/2021,
https://nuforc.org/sighting/?id=162091,02/05/2021 09:28,Pine City,NY,USA,,MADAR Node 82,02/17/2021,03/02/2021,
https://nuforc.org/sighting/?id=161985,02/05/2021 04:45,Cork (Ireland),,Ireland,Light,"Three large, bright blue lights moving in unison during the early morning.",02/10/2021,03/02/2021,
https://nuforc.org/sighting/?id=161897,02/05/2021 00:00,Millville,DE,USA,Sphere,Watching a airplane high in sky saw a silver object come out of the clouds west of airplane flew at high rate of dipped from one cloud,02/05/2021,03/02/2021,
https://nuforc.org/sighting/?id=162087,02/04/2021 22:50,Santa Claus,IN,USA,,MADAR Node 114,02/17/2021,03/02/2021,
https://nuforc.org/sighting/?id=161906,02/04/2021 21:30,Brewerton,NY,USA,Orb,"I saw an orange and purple, orb floating just above the horizon. It was suspended above a field at the end of dark road near my house.",02/04/2021,03/02/2021,
https://nuforc.org/sighting/?id=161960,02/04/2021 20:00,Sweetwater,TX,USA,Sphere,"Oblect approaches rapidly, pauses and holds position, then rapidly recedes into the sky, all in about ten seconds.",02/07/2021,03/02/2021,
https://nuforc.org/sighting/?id=161909,02/04/2021 19:00,Willimantic,CT,USA,Triangle,Two low flying triangle crafts with lights at tips of wings gravelly silently following very close together over Main Street Town Hall!,02/04/2021,03/02/2021,
https://nuforc.org/sighting/?id=168263,02/04/2021 18:50,Germantown,OH,USA,Sphere,Strange moving color changing sphere,05/18/2022,06/22/2022,
https://nuforc.org/sighting/?id=161911,02/04/2021 18:20,Irving,TX,USA,Cigar,"Feb. 4 2021 Irving, Tx. 2 600 ft cigar shaped grey / transparent flying in formation 1000mph+ 10 planes near object by DFW airport",02/04/2021,03/02/2021,
https://nuforc.org/sighting/?id=161913,02/04/2021 17:40,Endwell,NY,USA,Light,Bight fast moving light disappeared in the west,02/04/2021,03/02/2021,
https://nuforc.org/sighting/?id=161923,02/04/2021 07:45,Cary,NC,USA,Circle,Very bright and very slow moving from West to East. We first noticed its location next to the moon and thought it was a morning star. B,02/04/2021,03/02/2021,
https://nuforc.org/sighting/?id=161922,02/04/2021 07:10,King of Prussia,PA,USA,Light,Light moving across the sky over the Pennsylvania turnpike,02/04/2021,03/02/2021,
https://nuforc.org/sighting/?id=161921,02/04/2021 06:08,Rochester,NY,USA,Cigar,Silver/Blue cigar shaped hoovering over the lake from west to east,02/04/2021,03/02/2021,
https://nuforc.org/sighting/?id=161903,02/04/2021 03:30,Lynnwood,WA,USA,Unknown,Pig screams and noises?,02/04/2021,03/02/2021,
https://nuforc.org/sighting/?id=161924,02/04/2021 02:00,Newark,CA,USA,Light,Seen 3 lights zig zagging in the night sky.,02/04/2021,03/02/2021,
https://nuforc.org/sighting/?id=161964,02/04/2021 01:20,Tampa,FL,USA,Changing,I was driving at 1 AM and was looking at the moon when I saw a bright orange cross to the left of the moon and very low. The cross was,02/08/2021,03/02/2021,
https://nuforc.org/sighting/?id=161885,02/03/2021 22:40,Reading,PA,USA,Triangle,Triangular Craft Spotted Above Treeline in Reading,02/03/2021,03/02/2021,
https://nuforc.org/sighting/?id=161907,02/03/2021 20:20,Vernal,UT,USA,Circle,Giant bright red light in sky as well as other lights that we say phase out,02/04/2021,03/02/2021,
https://nuforc.org/sighting/?id=161886,02/03/2021 20:15,Fulton,MO,USA,Light,Bright green ball falling quickly from the sky.,02/03/2021,03/02/2021,
https://nuforc.org/sighting/?id=161887,02/03/2021 20:13,Mattoon,IL,USA,Circle,Flashing bright green and yellow circle flying across the sky and disappearing.,02/03/2021,03/02/2021,
https://nuforc.org/sighting/?id=161941,02/03/2021 19:20,Kure Beach,NC,USA,Sphere,Appeared over ocean single at first. Thought it was a Shrimp Boat. The second appeared about a minute later beside the first. Then a th,02/05/2021,03/02/2021,
https://nuforc.org/sighting/?id=161928,02/03/2021 19:00,Eugene,OR,USA,Diamond,Red lights in diamond form with two lights below diamond. Blinking and moving in a circle.,02/03/2021,03/02/2021,
https://nuforc.org/sighting/?id=174444,02/03/2021 13:22,Anonymous,NJ,USA,Changing,Important infiltration,02/12/2023,03/06/2023,
https://nuforc.org/sighting/?id=161935,02/03/2021 12:32,Evansville,IN,USA,Sphere,short series of photos shows spherical object traveling east. (((NUFORC Note: Possibly lens flares?? PD)),02/05/2021,03/02/2021,
https://nuforc.org/sighting/?id=168315,02/03/2021 09:58,West of Albuquerque New Mexico,AZ,USA,,I was on a flight of Southwest Airlines from Albuquerque to Phoenix at this time,05/17/2022,06/22/2022,
https://nuforc.org/sighting/?id=161896,02/03/2021 06:15,Derby (UK/England),,United Kingdom,Formation,Disappearing line of Star-Like Objects. ((Starlink satellites??)),02/03/2021,03/02/2021,
https://nuforc.org/sighting/?id=161895,02/03/2021 06:05,Ormond Beach,FL,USA,,((NUFORC Note: Witness provides no information about the sigting. PD)),02/03/2021,03/02/2021,
https://nuforc.org/sighting/?id=161920,02/03/2021 06:00,Nespelem,WA,USA,Circle,Numerous lights in a horizontal line in the sky moving from south to north. ((Starlink satellites??)),02/04/2021,03/02/2021,
https://nuforc.org/sighting/?id=161893,02/03/2021 02:20,Center Conway,NH,USA,Light,"NW night sky 25 degrees above horizontal, a stationary RED Light pulsed increasing and decreasing in intensity. Then it pulsed GREEN",02/03/2021,03/02/2021,
https://nuforc.org/sighting/?id=162278,02/03/2021 01:00,Colorado Springs,CO,USA,Orb,I was laying on my balcony since it was a nice sunny blue day. I saw a flicker in the sky in the corner of my eye. I looked closer and,03/04/2021,03/31/2021,
https://nuforc.org/sighting/?id=161925,02/03/2021 00:30,Geneva,NY,USA,Oval,Something I've never in my life seen before.,02/04/2021,03/02/2021,
https://nuforc.org/sighting/?id=161950,02/02/2021 19:30,Mauritius,,Mauritius,Flash,Flash of white light which disappeared mysteriously,02/07/2021,03/02/2021,
https://nuforc.org/sighting/?id=161883,02/02/2021 16:50,Fort Collins,CO,USA,Triangle,I looked straight up and moving across the sky was a triangle pattern of dim amber lights.,02/02/2021,03/02/2021,
https://nuforc.org/sighting/?id=161875,02/02/2021 11:15,Pflugerville,TX,USA,Oval,"Hovering, shapeshifting object becomes a sold white oval.",02/02/2021,03/02/2021,
https://nuforc.org/sighting/?id=172546,02/01/2021 21:00,Magnolia,TX,USA,Orb,Two small fast moving orbs that glow,10/24/2022,12/22/2022,
https://nuforc.org/sighting/?id=162050,02/01/2021 19:30,Eugene,OR,USA,Circle,"I’ve seen these lights most of my life, starting in 2001.",02/15/2021,03/02/2021,
https://nuforc.org/sighting/?id=161878,02/01/2021 18:50,Frisco,TX,USA,Light,4 orange glowing lights flying in single row formation. ((Starlink satellites??)),02/02/2021,03/02/2021,
https://nuforc.org/sighting/?id=162086,02/01/2021 17:02,Jonesboro,AR,USA,,MADAR Node 143,02/17/2021,03/02/2021,
https://nuforc.org/sighting/?id=162094,02/01/2021 15:36,Springfield,MO,USA,,MADAR Node 36,02/17/2021,03/02/2021,
https://nuforc.org/sighting/?id=162095,02/01/2021 15:25,Elizabeth,CO,USA,,MADAR Node 34,02/17/2021,03/02/2021,
https://nuforc.org/sighting/?id=161865,02/01/2021 09:00,Colorado Springs,CO,USA,Teardrop,8 ufo in the sky - looked like balloons but no baskets-stationary for over an hour now-teardrop when you zoom in - sitting over the cen,02/01/2021,03/02/2021,
