details,date,city,state,country,shape,summary,report_date,posted_date,image
https://nuforc.org/sighting/?id=172794,11/03/2022 11:30,Richmond,CA,USA,Circle,Seen a circular craft zig zaggin no sound,11/05/2022,12/22/2022,
https://nuforc.org/sighting/?id=172781,11/03/2022 01:35,Pittsburgh,PA,USA,Diamond,Not sure if it was a meteor or what,11/03/2022,12/22/2022,
https://nuforc.org/sighting/?id=172791,11/02/2022 23:23,Norman,OK,USA,Light,"Extremely fast moving blinking white light with whitish trail behind, not a plane, falling star or satellite.",11/05/2022,12/22/2022,
https://nuforc.org/sighting/?id=172750,11/02/2022 21:43,Columbus,OH,USA,Light,Odd S shaped flight pattern at high speed,11/02/2022,12/22/2022,
https://nuforc.org/sighting/?id=173112,11/02/2022 20:30,Everett,WA,USA,Changing,"Basically more than one sentence needed to explain, I will do my best to summarize below.",11/19/2022,12/22/2022,Y
https://nuforc.org/sighting/?id=172753,11/02/2022 19:23,Lititz,PA,USA,Light,"Bright light sat in the sky, moved, sat & took off",11/02/2022,12/22/2022,
https://nuforc.org/sighting/?id=173243,11/02/2022 19:15,Germantown,NY,USA,Triangle,"18 people on a local Facebook Group reported a triangular shape object in the sky that some say hovered, 18 people in total posted",12/03/2022,12/22/2022,
https://nuforc.org/sighting/?id=172755,11/02/2022 19:00,North east,MD,USA,Fireball,Streak of light,11/02/2022,12/22/2022,
https://nuforc.org/sighting/?id=172757,11/02/2022 18:41,lebanon,CT,USA,Triangle,triangle shaped white and red unit in sky hovering for hours. last night and tonight,11/02/2022,12/22/2022,
https://nuforc.org/sighting/?id=172913,11/02/2022 17:28,South Portland,ME,USA,Other,Two portal looking objects opened in sky 3 craft traveled between them,11/11/2022,12/22/2022,Y
https://nuforc.org/sighting/?id=172786,11/02/2022 17:15,South Portland,ME,USA,Other,Two portals? Craft flying between them,11/04/2022,12/22/2022,
https://nuforc.org/sighting/?id=174614,11/02/2022 13:45,Chatsworth,CA,USA,Triangle,A flying pyramid with wings,02/16/2023,03/06/2023,
https://nuforc.org/sighting/?id=172767,11/02/2022 01:30,Douglas/Bill,WY,USA,Light,1 second of bright green light 50 mile radius minimum,11/02/2022,12/22/2022,
https://nuforc.org/sighting/?id=172746,11/02/2022 00:20,New York,NY,USA,Unknown,A UFO shot through the sky a short distance and made a loud sound & omitted a flash & disappeared,11/01/2022,12/22/2022,
https://nuforc.org/sighting/?id=173281,11/01/2022 23:45,Bellingham,WA,USA,Circle,"Saw a tight, open bowl shaped formation of small round dots of light move quickly across the sky.",12/03/2022,12/22/2022,Y
https://nuforc.org/sighting/?id=172742,11/01/2022 23:26,Wesley Chapel,FL,USA,Light,Bright light traveling hyper speed.,11/01/2022,12/22/2022,
https://nuforc.org/sighting/?id=172745,11/01/2022 22:49,FRANKLIN,CT,USA,Triangle,"WHAT IS THE RED AND WHITE LIGHT HOVERING OVER FRANKLIN, CT ON 11/1/2022 9PM TO 11:35",11/01/2022,12/22/2022,
https://nuforc.org/sighting/?id=172787,11/01/2022 22:45,Sunrise,FL,USA,Light,High speed light in the sky,11/04/2022,12/22/2022,
https://nuforc.org/sighting/?id=172851,11/01/2022 22:30,Wasaga Beach,ON,Canada,Unknown,Pictures of weird flying object,11/07/2022,12/22/2022,Y
https://nuforc.org/sighting/?id=174201,11/01/2022 22:30,Wareham,MA,USA,Orb,I saw two amber orbs what seemed above the tree line.,01/29/2023,03/06/2023,Y
https://nuforc.org/sighting/?id=172811,11/01/2022 22:00,Panama city,FL,USA,Circle,"Is visible below the clouds bright white moves , sometimes wobbles across the sky.. approximately 2 to 3 k feet",11/04/2022,12/22/2022,
https://nuforc.org/sighting/?id=173192,11/01/2022 21:47,Inverness,FL,USA,Oval,"Bright irregular, fast, moving light at great altitude.",11/25/2022,12/22/2022,Y
https://nuforc.org/sighting/?id=172741,11/01/2022 21:28,Holladay,UT,USA,Cone,I saw 2 lights appear in the sky that moved to that moved into a cloud and then the lights disappeared,11/01/2022,12/22/2022,
https://nuforc.org/sighting/?id=173094,11/01/2022 21:11,Byesville,OH,USA,Circle,They are everywhere flying above tree tops. Very scared send help,11/20/2022,12/22/2022,
https://nuforc.org/sighting/?id=172812,11/01/2022 20:15,Adelanto,CA,USA,Light,We were just looking at the start and then...,11/04/2022,12/22/2022,
https://nuforc.org/sighting/?id=172743,11/01/2022 20:05,Bow,WA,USA,Sphere,A solid light with an orange tint appeared from above us moving at an abnormally fast speed bending direction.,11/01/2022,12/22/2022,
https://nuforc.org/sighting/?id=172664,11/01/2022 19:23,Hellam,PA,USA,Light,Linear lights in the sky that don’t appear to be starlink satellites.,11/01/2022,12/22/2022,Y
https://nuforc.org/sighting/?id=172793,11/01/2022 19:10,daleville,IN,USA,Unknown,Erratically strobed by unknown aerial vehicle,11/05/2022,12/22/2022,
https://nuforc.org/sighting/?id=172759,11/01/2022 17:18,San Antonio,TX,USA,Unknown,White object,11/02/2022,12/22/2022,
https://nuforc.org/sighting/?id=173636,11/01/2022 11:27,ALNESS,Scotland,United Kingdom,Circle,IT WAS HALF OF IT IN THE PICTHER THAT I GOT THERE WAS SPARKS CUMMING FROM THE TOP,12/30/2022,03/06/2023,Y
https://nuforc.org/sighting/?id=172671,11/01/2022 05:18,Mount Vernon,WA,USA,Circle,"Caught 2 lights a first then many more appeared, 2 white, 2 red, and one in another area that had 2 close by",11/01/2022,12/22/2022,
