details,date,city,state,country,shape,summary,report_date,posted_date,image
https://nuforc.org/sighting/?id=173236,11/30/2022 19:09,Choctaw,OK,USA,Triangle,3 lights hovering above road. Didn’t move or make a sound. Drove directly under it and could see that it was a small craft.,11/30/2022,12/22/2022,
https://nuforc.org/sighting/?id=177387,11/30/2022 19:00,Madison,WI,USA,Rectangle,Large rectangle translucent grey white with giant circles,08/04/2023,09/10/2023,
https://nuforc.org/sighting/?id=177358,11/30/2022 17:42,Portslade,East Sussex,United Kingdom,Disk,Puslating/ moving/ lights/ shooting into space,08/06/2023,09/10/2023,Y
https://nuforc.org/sighting/?id=173275,11/30/2022 14:15,,,Unspecified,Oval,"During the flight, a strange object was visible outside of the window, which stayed in the same position for 5 minutes, and flew away",12/01/2022,12/22/2022,Y
https://nuforc.org/sighting/?id=173235,11/30/2022 09:34,Csmpbrll,CA,USA,Light,Blue craft with a light inside around chem trails,11/30/2022,12/22/2022,Y
https://nuforc.org/sighting/?id=173233,11/29/2022 23:45,Napa,CA,USA,Triangle,Triangular craft with three white lights on corners of the object.,11/29/2022,12/22/2022,
https://nuforc.org/sighting/?id=173564,11/29/2022 22:00,Orlando,FL,USA,Sphere,Sphere moving fast,12/25/2022,03/06/2023,
https://nuforc.org/sighting/?id=173226,11/29/2022 21:27,Somis,CA,USA,Rectangle,Looked like it entered the atmosphere and then disappeared,11/29/2022,12/22/2022,
https://nuforc.org/sighting/?id=173227,11/29/2022 21:26,Austin,TX,USA,Fireball,Saw a bright object falling to the ground silently and quickly. It appeared to have green lights and an orange tracer following.,11/29/2022,12/22/2022,
https://nuforc.org/sighting/?id=173228,11/29/2022 20:20,Carolina Beach,NC,USA,Rectangle,Something just slowly flew over the homes around 8:20pm with 8 inch red lights running along the bottom of it. No sound.,11/29/2022,12/22/2022,Y
https://nuforc.org/sighting/?id=173379,11/29/2022 19:50,Colorado springs,CO,USA,Other,"Enormous object, looked like a rock, miles long",12/12/2022,12/22/2022,
https://nuforc.org/sighting/?id=173229,11/29/2022 18:55,Harper Woods,MI,USA,Diamond,Oddly shaped object that flew at a angle,11/29/2022,12/22/2022,
https://nuforc.org/sighting/?id=173255,11/29/2022 06:00,Portsmouth,NH,USA,Oval,While running in the early morning I saw these objects in the sky in my neighborhood.,12/03/2022,12/22/2022,Y
https://nuforc.org/sighting/?id=173224,11/28/2022 22:15,sun prairie,WI,USA,Triangle,Triangular Spaceship Object,11/28/2022,12/22/2022,
https://nuforc.org/sighting/?id=173206,11/28/2022 21:04,,GA,USA,Rectangle,"Oddly bright star, but when I zoomed in with my camera it had a strange shape",11/28/2022,12/22/2022,Y
https://nuforc.org/sighting/?id=173422,11/28/2022 06:30,Niagara Falls,NY,USA,Disk,Saw a disk fly over a red light while I was waiting for green. Other cars saw it because we did not all move when green.,12/15/2022,12/22/2022,
https://nuforc.org/sighting/?id=173211,11/28/2022 04:00,Sanford,NC,USA,Changing,Unidentified object changing form and color dancing in the sky,11/28/2022,12/22/2022,
https://nuforc.org/sighting/?id=174594,11/27/2022 21:23,Mary Esther,FL,USA,Triangle,"Black triangular craft, completely silent with 5 very dimly lit barley visible orange lights on the underside.",02/15/2023,03/06/2023,Y
https://nuforc.org/sighting/?id=173205,11/27/2022 21:00,Elkton,MD,USA,Unknown,Me and my husband seen UFO while standing on back deck looking at the stars.,11/27/2022,12/22/2022,
https://nuforc.org/sighting/?id=173726,11/27/2022 19:00,Thailand - flying above straight of malacca/andaman sea,,Thailand,Cylinder,Appeared to be extension of airplane wing until it flew away.,01/04/2023,03/06/2023,
https://nuforc.org/sighting/?id=173306,11/27/2022 16:38,lexington,SC,USA,Unknown,afternoon sky watching,12/06/2022,12/22/2022,
https://nuforc.org/sighting/?id=173250,11/27/2022 15:30,La Grange,TX,USA,Cylinder,Watched for about 5 minutes.,12/03/2022,12/22/2022,
https://nuforc.org/sighting/?id=173222,11/27/2022 14:00,Fargo,ND,USA,Circle,It was a circular object that would tip side to side black with a metallic glint when it would tip,11/27/2022,12/22/2022,
https://nuforc.org/sighting/?id=173199,11/26/2022 22:55,Hatboro,PA,USA,Triangle,Hovering craft,11/26/2022,12/22/2022,Y
https://nuforc.org/sighting/?id=173641,11/26/2022 22:35,Milford,NJ,USA,Sphere,White glowing sphere fall from sky,12/29/2022,03/06/2023,
https://nuforc.org/sighting/?id=173196,11/26/2022 19:15,Grand Rapids,MN,USA,Oval,Did not notice until I tried to edit my photo,11/26/2022,12/22/2022,
https://nuforc.org/sighting/?id=173201,11/26/2022 18:00,Richmond,CA,USA,Other,Gold in Color orb like a distant Star near Jupiter,11/26/2022,12/22/2022,
https://nuforc.org/sighting/?id=173204,11/26/2022 17:22,Island Pond,VT,USA,Light,Low flying white light moving west to east.,11/26/2022,12/22/2022,
https://nuforc.org/sighting/?id=173214,11/26/2022 16:30,Phila,PA,USA,Fireball,"Stationary fireball type object ,with horned type flames from top. ((NUFORC Note: Contrail. PD))",11/28/2022,12/22/2022,
https://nuforc.org/sighting/?id=173193,11/26/2022 14:17,Mount Holly,NJ,USA,Cone,"Driving up the bypass I witnessed a metallic almost glassy cone shaped object. It was upright and vertical, and was rotating.",11/26/2022,12/22/2022,Y
https://nuforc.org/sighting/?id=175055,11/26/2022 12:43,,NM,USA,Disk,Flash of Light with Grey Disk,03/19/2023,04/09/2023,Y
https://nuforc.org/sighting/?id=173195,11/26/2022 00:30,Wenatchee,WA,USA,Circle,I woke up and saw this outside of my window. I kept watching and then recorded.,11/26/2022,12/22/2022,
https://nuforc.org/sighting/?id=173198,11/26/2022 00:00,Port Orchard,WA,USA,Unknown,Coming from west. Can't see it.,11/26/2022,12/22/2022,
https://nuforc.org/sighting/?id=173404,11/25/2022 22:27,Satellite beach,FL,USA,Light,"Light off the ocean, thought it was a star then grew brighter and came closer to shore, then abruptly flew to horizon and vanished",12/13/2022,12/22/2022,
https://nuforc.org/sighting/?id=173714,11/25/2022 22:16,San diego,CA,USA,Circle,"I saw 2 balls of white light just hovering for a long while. As I saw a helicopter move closer, they started moving silently",01/03/2023,03/06/2023,
https://nuforc.org/sighting/?id=173188,11/25/2022 20:30,Greenwich,CT,USA,Sphere,Was walking dog and saw four circling lights moving rapidly and then coalescinng,11/25/2022,12/22/2022,
https://nuforc.org/sighting/?id=173184,11/25/2022 19:15,Sherwood Tigard,OR,USA,Light,Fast glowing lights just above clouds,11/25/2022,12/22/2022,
https://nuforc.org/sighting/?id=173221,11/25/2022 19:05,San Jose,CA,USA,Triangle,Ufo falling from outerspace,11/27/2022,12/22/2022,
https://nuforc.org/sighting/?id=173194,11/25/2022 18:30,Lemon Grove,CA,USA,Changing,"Every night these lights appear, and will even fallow when I leave. Pulse at my phone",11/26/2022,12/22/2022,
https://nuforc.org/sighting/?id=178781,11/25/2022 05:20,Buckeye,AZ,USA,Other,Slow low flying aircraft,10/09/2023,10/28/2023,Y
https://nuforc.org/sighting/?id=173167,11/24/2022 21:25,lockford,CA,USA,Light,intense red light hovering then moving towards ground quickly.,11/24/2022,12/22/2022,
https://nuforc.org/sighting/?id=173191,11/24/2022 20:34,Huntley,MT,USA,Cylinder,Aspirin shaped craft,11/25/2022,12/22/2022,Y
https://nuforc.org/sighting/?id=173232,11/24/2022 20:22,London,London Borough of Islington,United Kingdom,Triangle,I saw a craft shaped like a bumerang with bright lights all over the sides of it,11/29/2022,12/22/2022,Y
https://nuforc.org/sighting/?id=173301,11/24/2022 19:45,Fairfield,CA,USA,Circle,Bright reddish orange light visable for approx. 25 to 30 seconds then disappeared,12/05/2022,12/22/2022,
https://nuforc.org/sighting/?id=173170,11/24/2022 18:30,Wausau,WI,USA,Unknown,It was blinking lights unsure about the shape it was too high,11/24/2022,12/22/2022,
https://nuforc.org/sighting/?id=174354,11/24/2022 17:30,Manchester,NH,USA,Cross,It had for round fans light silver and it was a black gunmetal color very sleek design size a a van or SUV. Quiet no sound like it was,02/08/2023,03/06/2023,
https://nuforc.org/sighting/?id=173197,11/24/2022 10:20,ste-sophie,QC,Canada,Cylinder,space,11/26/2022,12/22/2022,
https://nuforc.org/sighting/?id=173326,11/24/2022 04:23,New Lisbon,WI,USA,Circle,I have pics on trail cameras from different areas on my property,12/09/2022,12/22/2022,
https://nuforc.org/sighting/?id=173190,11/23/2022 23:01,Albuquerque,NM,USA,Oval,appeared to be hovering about the houses in my neighborhood moving very slowly.,11/25/2022,12/22/2022,
https://nuforc.org/sighting/?id=173175,11/23/2022 22:55,Thamesford,ON,Canada,Light,Round light - gradually growers brighter and bigger,11/23/2022,12/22/2022,
https://nuforc.org/sighting/?id=173177,11/23/2022 22:48,Sea Isle,NJ,USA,Other,"Clear sky, floating orange glow clearly not standard aircraft",11/23/2022,12/22/2022,Y
https://nuforc.org/sighting/?id=173176,11/23/2022 22:15,Between Centerview and alone Jack,MO,USA,Light,"Saw lights flashing through the sky over the highway in all directions. Formed circle and rotated, kept getting large then small",11/23/2022,12/22/2022,
https://nuforc.org/sighting/?id=173808,11/23/2022 21:20,Cadillac,MI,USA,Orb,Witnessed two orbs crossing above two lakes high in air.,01/09/2023,03/06/2023,
https://nuforc.org/sighting/?id=173171,11/23/2022 20:12,Normal,IL,USA,Changing,"Gazing out South SW we saw 3 changing objects. Diamond, cylinder, tic tac, house shape, w blue, yellow, orange. They bounced around.",11/24/2022,12/22/2022,Y
https://nuforc.org/sighting/?id=173181,11/23/2022 20:00,Yonkers,NY,USA,Circle,Numerous objects north to southwest,11/23/2022,12/22/2022,
https://nuforc.org/sighting/?id=173183,11/23/2022 20:00,Fishers,IN,USA,Light,"LIne of round lights moving south to north in single file (white light with reddish tint) -- definitely ""flying""",11/23/2022,12/22/2022,
https://nuforc.org/sighting/?id=173466,11/23/2022 19:15,Normal,IL,USA,Changing,"I saw and recorded changing UAP, shapes and changing colors, it ping ponged around the sky, I have crazy screenshots of my 8 min video",12/18/2022,12/22/2022,Y
https://nuforc.org/sighting/?id=173182,11/23/2022 18:20,Deming,NM,USA,Changing,"Heard an animal howl, went out front door to investigate. Heard a loud mechanical buzz then saw lights.",11/23/2022,12/22/2022,
https://nuforc.org/sighting/?id=173161,11/23/2022 11:27,Independence,OH,USA,Disk,"UFO displaying advanced camouflage, it showed an outline of itself when it went over power lines, it seemed to reflect light around",11/23/2022,12/22/2022,Y
https://nuforc.org/sighting/?id=173078,11/23/2022 02:45,Huachuca City,AZ,USA,Sphere,Spotted object in the eastern sky when letting my dog out.,11/18/2022,12/22/2022,Y
https://nuforc.org/sighting/?id=173173,11/23/2022 00:30,Flora,IL,USA,Triangle,The craft flew over my house at 12:30AM completely silent and no lights while I was outside with my dog.,11/24/2022,12/22/2022,
https://nuforc.org/sighting/?id=173152,11/22/2022 22:50,Pittsburgh,PA,USA,Cross,Two brightly lit objects appeared simultaneously on the horizon flying over our home approximately 5 -,11/22/2022,12/22/2022,
https://nuforc.org/sighting/?id=173187,11/22/2022 22:00,Las Vegas,NV,USA,Teardrop,Bright glowing green object,11/25/2022,12/22/2022,
https://nuforc.org/sighting/?id=173153,11/22/2022 21:38,Bridgeport,CT,USA,Triangle,One flying unidentified object seen. There were blue and red lights flashing. The color changed from blue to red and red to blue quick.,11/22/2022,12/22/2022,Y
https://nuforc.org/sighting/?id=174107,11/22/2022 21:04,Ashley,OH,USA,Changing,"I saw an circle ball flashing from blue, to green, to clear moving erratically very fast up, down and side to side. Then it changed sh",01/24/2023,03/06/2023,Y
https://nuforc.org/sighting/?id=173156,11/22/2022 20:32,Sunman,IN,USA,Light,"2 seconds light, 5000-ish ft high, traveling east to west. Could not hear engine or nothing, absolute silence.",11/22/2022,12/22/2022,
https://nuforc.org/sighting/?id=173150,11/22/2022 18:30,North Branford,CT,USA,Triangle,One with triangle light sequence one very bright,11/21/2022,12/22/2022,
https://nuforc.org/sighting/?id=173162,11/22/2022 18:05,Carbondale,IL,USA,Triangle,The craft was seen in the Northeast sky moving westbound at 6:05 pm 11/22/2022.,11/23/2022,12/22/2022,
https://nuforc.org/sighting/?id=173159,11/22/2022 17:56,Chicago,IL,USA,Light,Three lights flashing and stationed,11/22/2022,12/22/2022,
https://nuforc.org/sighting/?id=173158,11/22/2022 17:21,Waterford,CT,USA,Unknown,The left one was bigger and white- the right was was smaller and red. It was NOT airplanes. ((NUFORC Note: Contrails. PD)),11/22/2022,12/22/2022,Y
https://nuforc.org/sighting/?id=173166,11/22/2022 17:08,Lopatcong,NJ,USA,Circle,circled moving left to right then back to left in relation to each other.,11/23/2022,12/22/2022,Y
https://nuforc.org/sighting/?id=173154,11/22/2022 16:54,San Diego,CA,USA,Light,"I seen 4 lights in a line, 3 moved formatically",11/22/2022,12/22/2022,
https://nuforc.org/sighting/?id=173174,11/22/2022 16:47,Mount Joy,PA,USA,Light,Extremely bright light blinking on then off and moved to different position in high atmosphere,11/24/2022,12/22/2022,
https://nuforc.org/sighting/?id=173140,11/22/2022 09:09,Roseville,MN,USA,Changing,Electromagnetic pulse,11/22/2022,12/22/2022,
https://nuforc.org/sighting/?id=173142,11/22/2022 08:50,Roseville,MN,USA,Triangle,Orangish zigzag diamond shaped thing,11/22/2022,12/22/2022,Y
https://nuforc.org/sighting/?id=173141,11/22/2022 08:40,Wauconda,IL,USA,Oval,Saw metal object hovering disappeared and reappeared,11/22/2022,12/22/2022,
https://nuforc.org/sighting/?id=173138,11/22/2022 02:36,Menifee,CA,USA,Fireball,"Blue disk like fire ball appeared in the sky, Flew downwards into the sky and disappeared instantly.",11/22/2022,12/22/2022,
https://nuforc.org/sighting/?id=173186,11/22/2022 02:30,Sofia,Sofia City Province,Bulgaria,Diamond,1 object far away,11/25/2022,12/22/2022,Y
https://nuforc.org/sighting/?id=173053,11/21/2022 23:49,Las Vegas,NV,USA,Triangle,Right over me me would play saying traingles right over me my senses would like amplify and I would black out sometimes,11/17/2022,12/22/2022,
https://nuforc.org/sighting/?id=173145,11/21/2022 22:00,Downingtown,PA,USA,Fireball,Radiation emitting from changing ever present thing,11/21/2022,12/22/2022,
https://nuforc.org/sighting/?id=175448,11/21/2022 21:00,Orlando,FL,USA,Unknown,Didn’t even notice until I shared this photo on Facebook and my cousin saw all the lights,04/22/2023,05/19/2023,Y
https://nuforc.org/sighting/?id=173126,11/21/2022 20:45,Forest Lake,MN,USA,Unknown,We saw 3 objects appear in Eastern sky at dusk one evening on our pontoon,11/21/2022,12/22/2022,
https://nuforc.org/sighting/?id=173157,11/21/2022 20:30,Steger,IL,USA,Unknown,hovering & meandering object 2 red sequential blinking lights and solid greenish lights flew overhead then W/NW over forest over a mile,11/22/2022,12/22/2022,Y
https://nuforc.org/sighting/?id=173147,11/21/2022 20:00,Johnstown,PA,USA,Star,"Moves at high speed in multiple directions, changes from solid white to solid blue or red light,",11/21/2022,12/22/2022,
https://nuforc.org/sighting/?id=173148,11/21/2022 19:10,Oregon,WI,USA,Circle,Drone sightings?,11/21/2022,12/22/2022,
https://nuforc.org/sighting/?id=173127,11/21/2022 09:13,Las Vegas,NV,USA,Unknown,"Saw what appeared to be a piece of blowing trash at ~400' altitude and about ~60mph, but then realized conditions were calm.",11/21/2022,12/22/2022,
https://nuforc.org/sighting/?id=173087,11/20/2022 22:52,Mt. Hope,WV,USA,Other,"Distant sighting, unfortunately I may not have enough useful info to be helpful",11/20/2022,12/22/2022,
https://nuforc.org/sighting/?id=173131,11/20/2022 22:00,Oregon,WI,USA,Circle,See videos,11/21/2022,12/22/2022,
https://nuforc.org/sighting/?id=173090,11/20/2022 20:15,Los Alamos,NM,USA,Light,Unexplainable FAST Aircraft,11/20/2022,12/22/2022,
https://nuforc.org/sighting/?id=173164,11/20/2022 18:58,,FL,USA,Triangle,Silent UFO IN THE NIGHT,11/23/2022,12/22/2022,
https://nuforc.org/sighting/?id=173010,11/20/2022 18:50,San Antonio,TX,USA,Light,Light passed over car on access road and disappeared,11/14/2022,12/22/2022,Y
https://nuforc.org/sighting/?id=173098,11/20/2022 18:20,Gaithersburg,MD,USA,Light,It was a string if vertical light and above that a shorter string of horizontal lights moving in perfect formation,11/20/2022,12/22/2022,
https://nuforc.org/sighting/?id=173516,11/20/2022 18:01,Thane,Maharashtra,India,Unknown,This was not an aircraft. Please check the video.,12/22/2022,12/22/2022,
https://nuforc.org/sighting/?id=173143,11/20/2022 17:25,Flint,MI,USA,Fireball,"Fell from the sky, entered our atmosphere..floated around, shot back Into space",11/22/2022,12/22/2022,Y
https://nuforc.org/sighting/?id=173952,11/20/2022 17:25,Whitehall,MT,USA,Cylinder,I saw it coming out from hunting and took a video,01/15/2023,03/06/2023,
https://nuforc.org/sighting/?id=178104,11/20/2022 17:21,,NJ,USA,Cigar,It was on the news hovering over a high way. I was right before the highway when I saw it,09/06/2023,09/10/2023,Y
https://nuforc.org/sighting/?id=173089,11/20/2022 17:01,Hibbing or Kelly Lake,MN,USA,Unknown,Pulsating clear lights,11/20/2022,12/22/2022,Y
https://nuforc.org/sighting/?id=174211,11/20/2022 16:53,Honeoye Falls,NY,USA,Disk,I saw this in the sky and it caught my attention enough so to take pictures. This was slow moving bright at first but slowly faded away,01/30/2023,03/06/2023,
https://nuforc.org/sighting/?id=174147,11/20/2022 16:25,Fremont,CA,USA,Circle,"I saw numerous orange ball like objects in different sections of the sky, moving in all directions",01/26/2023,03/06/2023,
https://nuforc.org/sighting/?id=173105,11/20/2022 12:17,Fisherville,KY,USA,Changing,"Bright, Changing Spot Changing Shape Near Airplane",11/20/2022,12/22/2022,Y
https://nuforc.org/sighting/?id=173104,11/20/2022 10:45,NORTH HOLLYWOOD,CA,USA,Light,"Slow, deliberate (but non satellite behavior), reflective",11/20/2022,12/22/2022,Y
https://nuforc.org/sighting/?id=173111,11/19/2022 23:49,Thamesford,ON,Canada,Changing,Saucer life bright ball in sky with blue lights,11/19/2022,12/22/2022,
https://nuforc.org/sighting/?id=173062,11/19/2022 22:02,Sun city,AZ,USA,Light,"I was walking a dog and saw a bright light in the sky I thought was a star but it was changing colors, moving and seemed to respond",11/17/2022,12/22/2022,
https://nuforc.org/sighting/?id=173914,11/19/2022 21:56,Cockeysville,MD,USA,Chevron,We spotted a chevron-like craft seemingly very low to the ground with 2 faint circular lights on both wings with no visible light bulb.,01/13/2023,03/06/2023,Y
https://nuforc.org/sighting/?id=173106,11/19/2022 21:40,Orcutt,CA,USA,Light,Strange light flashing red also possibly blue or green,11/20/2022,12/22/2022,Y
https://nuforc.org/sighting/?id=173096,11/19/2022 21:36,Maplewood,MN,USA,Disk,Noted ufo when driving,11/20/2022,12/22/2022,Y
https://nuforc.org/sighting/?id=173552,11/19/2022 21:21,Gold Hill,OR,USA,Unknown,"Large black very slow moving, just vanished into a fireball looking “hole”",12/24/2022,03/06/2023,Y
https://nuforc.org/sighting/?id=173136,11/19/2022 21:03,Holly Hill,SC,USA,Diamond,"Diamond shape figure. Hoovering in one area, it had red, green, blue lights flashing on it. At times it would make a sudden jerk upward",11/22/2022,12/22/2022,
https://nuforc.org/sighting/?id=175141,11/19/2022 19:37,Winston Salem,NC,USA,Circle,"Unidentified large aircraft flying over my backyard in plan view, very close so details were visible to the eyes.",03/27/2023,04/09/2023,Y
https://nuforc.org/sighting/?id=173103,11/19/2022 19:36,Winston Salem,NC,USA,Circle,"Circle shaped, lights (different colors) around, dark gray color, very large size, humming sounds as slow passing. Another person w",11/20/2022,12/22/2022,Y
https://nuforc.org/sighting/?id=173118,11/19/2022 18:07,Brandywine,MD,USA,Circle,Slow moving light with blue aura about 2/3rds through the video,11/19/2022,12/22/2022,
https://nuforc.org/sighting/?id=173449,11/19/2022 18:05,Eugene,OR,USA,Changing,"t had red, white lights went back and forth. Hovering and quick, then zig zag motions.",12/17/2022,12/22/2022,
https://nuforc.org/sighting/?id=173099,11/19/2022 17:55,Chicago,IL,USA,Rectangle,A green unidentified flying object appeared while I was taking a video,11/20/2022,12/22/2022,Y
https://nuforc.org/sighting/?id=173100,11/19/2022 15:51,bellgrade,MT,USA,Disk,UFO/ UAP over Bozeman Montana. Ship was at least 100 yards width and 20 yards hight hovering for two min and disappearing in a flash,11/20/2022,12/22/2022,
https://nuforc.org/sighting/?id=175136,11/19/2022 09:07,Melbourne,Victoria,Australia,Cross,I have a hunting security camera and it caught something very strange,03/27/2023,04/09/2023,Y
https://nuforc.org/sighting/?id=173108,11/19/2022 07:10,Fulks Run,VA,USA,Changing,I'm still covered in goose bumps sleep was impossible life has been forever changed,11/20/2022,12/22/2022,
https://nuforc.org/sighting/?id=173116,11/19/2022 02:40,St Louis,MO,USA,Triangle,Triangle Shaped Reflective Cloak,11/19/2022,12/22/2022,
https://nuforc.org/sighting/?id=178532,11/19/2022 02:15,Franklin,NH,USA,Triangle,"I went outside for a smoke a bit late at night, went outside, closed the front door, looked above me and saw it.",10/04/2023,10/28/2023,
https://nuforc.org/sighting/?id=173083,11/18/2022 22:46,Morpeth,Northumberland,United Kingdom,Triangle,Bright triangle craft,11/19/2022,12/22/2022,
https://nuforc.org/sighting/?id=173079,11/18/2022 19:14,Mount Horeb,WI,USA,Other,"almost satellite/telescope shaped but was either very large or very close. flew soundlessly and smoothly, rotated as it went",11/18/2022,12/22/2022,Y
https://nuforc.org/sighting/?id=173085,11/18/2022 18:00,Payson,AZ,USA,Circle,6-8 Orange balls of light following each other,11/19/2022,12/22/2022,
https://nuforc.org/sighting/?id=173795,11/18/2022 06:18,Pacific Grove,CA,USA,Changing,I saw a bright light shape shifting craft that vanished with zero sound.,01/08/2023,03/06/2023,
https://nuforc.org/sighting/?id=173088,11/18/2022 02:00,Fallbrook,CA,USA,Triangle,Flashing moving object,11/20/2022,12/22/2022,Y
https://nuforc.org/sighting/?id=173086,11/18/2022 01:19,Northridge,CA,USA,Oval,Similar in brightness to a satellite. Two points (front/rear?) with “reflection” showing oval to round shape.,11/19/2022,12/22/2022,
https://nuforc.org/sighting/?id=173052,11/18/2022 00:46,The Villages,FL,USA,Orb,Circular pattern of 4-5 small white discs or orbs,11/17/2022,12/22/2022,
https://nuforc.org/sighting/?id=173072,11/18/2022 00:14,Leavenworth,WA,USA,Cross,Light,11/18/2022,12/22/2022,Y
https://nuforc.org/sighting/?id=173066,11/17/2022 23:02,West Hollywood,CA,USA,Changing,This is exactly the craft Roger Marsh witnessed.,11/18/2022,12/22/2022,
https://nuforc.org/sighting/?id=173616,11/17/2022 22:38,Myrtle Beach,SC,USA,Cigar,I didn’t notice the object at first. I was taking a photo of my view from my back patio to send a friend.,12/28/2022,03/06/2023,Y
https://nuforc.org/sighting/?id=173055,11/17/2022 22:02,Vestavia Hills,AL,USA,Formation,Strange gray object that seemed like a formation of many objects that changed shape as it moved,11/17/2022,12/22/2022,Y
https://nuforc.org/sighting/?id=173071,11/17/2022 20:31,Newcastle,WA,USA,Light,Plasma shape shifting bright ball,11/18/2022,12/22/2022,
https://nuforc.org/sighting/?id=174596,11/17/2022 19:30,Moses Lake,WA,USA,Disk,"Clear skies and 26 Degrees, looked like a copper penny on its side. lighter on top and darker on the bottom.",02/15/2023,03/06/2023,
https://nuforc.org/sighting/?id=173751,11/17/2022 17:36,Raleigh,NC,USA,Disk,"I was outside during working a catering event and decided to take a picture of the sky,not knowing what I took until hours later.",01/05/2023,03/06/2023,Y
https://nuforc.org/sighting/?id=173073,11/17/2022 11:24,Hayden,ID,USA,Unknown,"This sound woke me up, and I hurried outside and eventually took my boots off to quickly videotape this.",11/18/2022,12/22/2022,
https://nuforc.org/sighting/?id=173128,11/17/2022 08:51,Casa Grande,AZ,USA,Sphere,I witnessed a round very bright ball of light. No sound nothing else in the sky. In a blink of an eye it was gone off to the east.,11/21/2022,12/22/2022,
https://nuforc.org/sighting/?id=173050,11/17/2022 07:24,Ponce inlet,FL,USA,Teardrop,Saw a ufo in a pic I took after the fact,11/17/2022,12/22/2022,Y
https://nuforc.org/sighting/?id=172987,11/17/2022 03:25,Vermillion,SD,USA,Unknown,I started to record this light through my peephole and I caught the light gradually changing I captured something a being of some sort.,11/14/2022,12/22/2022,Y
https://nuforc.org/sighting/?id=173051,11/17/2022 01:35,Columbus,OH,USA,Orb,Erratically flying orbs were darting back and forth until they disappeared altogether.,11/17/2022,12/22/2022,Y
https://nuforc.org/sighting/?id=173075,11/17/2022 00:45,The Villages,FL,USA,Circle,"Spotlight-like circlesoriginating from ISS, illuminating the underside of cloud cover",11/18/2022,12/22/2022,
https://nuforc.org/sighting/?id=175064,11/16/2022 22:03,mechanicsburg,PA,USA,Circle,small green light moving in different directions and stopping. dissapeared behind clouds.,03/20/2023,04/09/2023,
https://nuforc.org/sighting/?id=174206,11/16/2022 22:00,Jermyn,PA,USA,Oval,Was still sitting then went straight up and flew over,01/29/2023,03/06/2023,
https://nuforc.org/sighting/?id=173767,11/16/2022 21:36,Lorton,VA,USA,Changing,This was seen by multiple people in Northern Virginia,01/06/2023,03/06/2023,
https://nuforc.org/sighting/?id=173040,11/16/2022 20:34,Abiquiu,NM,USA,Light,Lights hovering parallel to the ground along a fence and off the cliff,11/16/2022,12/22/2022,Y
https://nuforc.org/sighting/?id=173063,11/16/2022 20:03,Summerville,SC,USA,Light,"3 groups of lights were seen moving quickly, silently, over our property",11/17/2022,12/22/2022,
