details,date,city,state,country,shape,summary,report_date,posted_date,image
https://nuforc.org/sighting/?id=173752,01/05/2023 18:40,Wall Township,NJ,USA,Unknown,There were four lights moving in unison with no sound at all.,01/05/2023,03/06/2023,
https://nuforc.org/sighting/?id=173765,01/05/2023 18:15,Miami,MA,USA,Light,I took a picture of the beautiful moon and the lights showed in in the cloud below the moon.,01/06/2023,03/06/2023,Y
https://nuforc.org/sighting/?id=173741,01/05/2023 18:03,Nazareth,PA,USA,Cylinder,Looked out towards my window and saw an unidentified object floating in the air.,01/05/2023,03/06/2023,Y
https://nuforc.org/sighting/?id=173748,01/05/2023 08:00,Kingman,AZ,USA,Other,When looking back over sunrise photos from this morning,01/05/2023,03/06/2023,Y
https://nuforc.org/sighting/?id=173749,01/05/2023 07:30,Longview,NC,USA,Cigar,"Pill shaped object, looked like a blinking star.",01/05/2023,03/06/2023,Y
https://nuforc.org/sighting/?id=173823,01/04/2023 21:51,Brook Highland,AL,USA,Unknown,Took a video of a craft shining many colors without having any aircraft type identifying lights. Object flew towards Lake Purdy,01/09/2023,03/06/2023,
https://nuforc.org/sighting/?id=173737,01/04/2023 21:40,Between Maine & Binghamton,NY,USA,Oval,Saw bright oval/shaped craft,01/04/2023,03/06/2023,
https://nuforc.org/sighting/?id=173978,01/04/2023 21:15,Forney,TX,USA,Chevron,Chevron shape hovering in place,01/18/2023,03/06/2023,Y
https://nuforc.org/sighting/?id=173793,01/04/2023 16:06,Duson,LA,USA,Cylinder,No way it was another airplane or chopper,01/07/2023,03/06/2023,Y
https://nuforc.org/sighting/?id=174290,01/04/2023 02:08,Tel aviv,,Israel,Light,A craft appeared in my bedroom and a being emerged conversing with me.,02/03/2023,03/06/2023,
https://nuforc.org/sighting/?id=173708,01/04/2023 01:15,Brisbane,Queensland,Australia,Light,I’ve seen a couple of these lately and they’re all a bit different from one another but this latest one was very bright and was contrll,01/03/2023,03/06/2023,
https://nuforc.org/sighting/?id=173750,01/04/2023 00:30,Fresno,CA,USA,Circle,There was bright white maybe silver lights and then a lil bit of blue or green lights .,01/05/2023,03/06/2023,
https://nuforc.org/sighting/?id=173772,01/03/2023 23:38,Charlotte,NC,USA,Cylinder,I was walking alone just going for my usual midnight walk,01/06/2023,03/06/2023,
https://nuforc.org/sighting/?id=173778,01/03/2023 23:30,New Castle,PA,USA,Cigar,25 Cigar Bright Shaped high as plane,01/07/2023,03/06/2023,
https://nuforc.org/sighting/?id=174913,01/03/2023 15:57,Yuma,AZ,USA,Fireball,a luminous big ball hung over the mountain,03/07/2023,04/09/2023,Y
https://nuforc.org/sighting/?id=173723,01/02/2023 22:00,Seattle,WA,USA,Orb,"Bright gold sphere aircraft pulsating, flies to west horizon and erupts in red light",01/03/2023,03/06/2023,
https://nuforc.org/sighting/?id=173910,01/02/2023 21:30,Wilmington,DE,USA,Oval,Sighted a large dark oval shaped figure with 3 red lights in a trangle formation,01/13/2023,03/06/2023,
https://nuforc.org/sighting/?id=173703,01/02/2023 19:09,Near Hagerstown,MD,USA,Triangle,"Latest was bottom view almost directly overhead, 3 lights equidistant apart side lite up, short jerky moves at times, seen East to West",01/02/2023,03/06/2023,
https://nuforc.org/sighting/?id=173709,01/02/2023 19:00,Lakeville,MA,USA,Changing,"This is 4th report, the sighting evolves each time I'm out observing.. picking up on more details of the crafts.",01/03/2023,03/06/2023,
https://nuforc.org/sighting/?id=174125,01/02/2023 01:00,Albany,NY,USA,Cigar,Object came down from the sky,01/25/2023,03/06/2023,
https://nuforc.org/sighting/?id=173683,01/02/2023 00:30,Newark,CA,USA,Other,Why isn’t anyone reporting this on news?,01/02/2023,03/06/2023,
https://nuforc.org/sighting/?id=174719,01/01/2023 23:59,Forest City,AR,USA,Oval,A shadow came across with lights hitting the ground and a spot light type light,02/26/2023,03/06/2023,Y
https://nuforc.org/sighting/?id=173897,01/01/2023 22:00,Woodville,AL,USA,Unknown,Bright light in the middle of nowhere. Did not move like a lot flying aircraft in that it moved laterally & straight up & down in sec.,01/13/2023,03/06/2023,
https://nuforc.org/sighting/?id=173689,01/01/2023 20:55,Edgewater,FL,USA,Cylinder,Spotted a low flying silent orange object coming from east to west lasted about 5 mins or so glowing went away to dim white light disa,01/01/2023,03/06/2023,Y
https://nuforc.org/sighting/?id=173706,01/01/2023 18:40,Wantagh,NY,USA,Circle,It was a bright light would blink stay light then move a weird way almost looked like a drone but it definitely was not a drone,01/03/2023,03/06/2023,
https://nuforc.org/sighting/?id=173691,01/01/2023 18:30,TUCSON,AZ,USA,Unknown,40+ lights in the atmosphere moving in all directions,01/02/2023,03/06/2023,
https://nuforc.org/sighting/?id=173694,01/01/2023 18:05,Poi pu,HI,USA,Circle,Saw UFO after taking photo of the sunset,01/02/2023,03/06/2023,Y
https://nuforc.org/sighting/?id=174930,01/01/2023 18:00,Middlebourne,WV,USA,Sphere,My fiance and I along with a friend were driving home when 3 crafts appeared right beside us on the road.,03/08/2023,04/09/2023,
https://nuforc.org/sighting/?id=173802,01/01/2023 17:48,Blaine,MN,USA,Circle,Odd light in sky caught on Ring video camera.,01/08/2023,03/06/2023,
https://nuforc.org/sighting/?id=173676,01/01/2023 16:56,Duck,NC,USA,Unknown,Multiple streaks changing direction with at times showing a dark craft.,01/01/2023,03/06/2023,
https://nuforc.org/sighting/?id=173705,01/01/2023 16:45,Clovis,NM,USA,Cigar,Cigar shape bobbed in & out of clouds in place.,01/02/2023,03/06/2023,
https://nuforc.org/sighting/?id=173977,01/01/2023 12:00,Roanoke,VA,USA,Unknown,Red bell moving in jerky almost as u would move a laser pointer.,01/18/2023,03/06/2023,
https://nuforc.org/sighting/?id=173673,01/01/2023 10:56,Los Angeles,CA,USA,Circle,Saw a fast moving disc when coming into land at LAX airport,01/01/2023,03/06/2023,
https://nuforc.org/sighting/?id=173674,01/01/2023 09:48,Marfa,TX,USA,Other,Random white structure in the sky- not moving at all,01/01/2023,03/06/2023,Y
https://nuforc.org/sighting/?id=173906,01/01/2023 07:01,North Myrtle Beach,SC,USA,Cylinder,Seen just before sunrise on New Year's Day,01/14/2023,03/06/2023,Y
https://nuforc.org/sighting/?id=173680,01/01/2023 05:05,Pendleton,OR,USA,Light,Orange light hovering and maybe very slowly floating to the North.,01/01/2023,03/06/2023,Y
https://nuforc.org/sighting/?id=173707,01/01/2023 02:06,Plano,TX,USA,Light,My friend and I were sitting in her car saw this bright orange glowing thing very quick and steady fly over us.,01/03/2023,03/06/2023,
https://nuforc.org/sighting/?id=174475,01/01/2023 01:30,Port Charlotte,FL,USA,Triangle,I have never seen anything like this before and no noise,02/12/2023,03/06/2023,Y
https://nuforc.org/sighting/?id=173660,01/01/2023 00:45,North Chesterfield,VA,USA,Formation,Two lights moving together in formation at fast speed,12/31/2022,03/06/2023,
https://nuforc.org/sighting/?id=173668,01/01/2023 00:30,Hyattsville,MD,USA,Triangle,Triangle formation,01/01/2023,03/06/2023,
https://nuforc.org/sighting/?id=173675,01/01/2023 00:30,Waialua,HI,USA,Formation,Numerous greenish twinkling stars in a swarm slowing drifting over ocean.,01/01/2023,03/06/2023,
https://nuforc.org/sighting/?id=173688,01/01/2023 00:30,Houston,TX,USA,Rectangle,Four objects flying over neighborhood,01/01/2023,03/06/2023,Y
https://nuforc.org/sighting/?id=173671,01/01/2023 00:03,Roma,TX,USA,Fireball,"A series of fireballs in different sequence, that lasted over a series of minutes",01/01/2023,03/06/2023,Y
https://nuforc.org/sighting/?id=173717,01/01/2023 00:03,Warm Springs,OR,USA,Disk,Security Camera Footage,01/03/2023,03/06/2023,
https://nuforc.org/sighting/?id=174719,01/01/2023 23:59,Forest City,AR,USA,Oval,A shadow came across with lights hitting the ground and a spot light type light,02/26/2023,03/06/2023,Y
https://nuforc.org/sighting/?id=173897,01/01/2023 22:00,Woodville,AL,USA,Unknown,Bright light in the middle of nowhere. Did not move like a lot flying aircraft in that it moved laterally & straight up & down in sec.,01/13/2023,03/06/2023,
https://nuforc.org/sighting/?id=173689,01/01/2023 20:55,Edgewater,FL,USA,Cylinder,Spotted a low flying silent orange object coming from east to west lasted about 5 mins or so glowing went away to dim white light disa,01/01/2023,03/06/2023,Y
https://nuforc.org/sighting/?id=173706,01/01/2023 18:40,Wantagh,NY,USA,Circle,It was a bright light would blink stay light then move a weird way almost looked like a drone but it definitely was not a drone,01/03/2023,03/06/2023,
https://nuforc.org/sighting/?id=173691,01/01/2023 18:30,TUCSON,AZ,USA,Unknown,40+ lights in the atmosphere moving in all directions,01/02/2023,03/06/2023,
https://nuforc.org/sighting/?id=173694,01/01/2023 18:05,Poi pu,HI,USA,Circle,Saw UFO after taking photo of the sunset,01/02/2023,03/06/2023,Y
https://nuforc.org/sighting/?id=174930,01/01/2023 18:00,Middlebourne,WV,USA,Sphere,My fiance and I along with a friend were driving home when 3 crafts appeared right beside us on the road.,03/08/2023,04/09/2023,
https://nuforc.org/sighting/?id=173802,01/01/2023 17:48,Blaine,MN,USA,Circle,Odd light in sky caught on Ring video camera.,01/08/2023,03/06/2023,
https://nuforc.org/sighting/?id=173676,01/01/2023 16:56,Duck,NC,USA,Unknown,Multiple streaks changing direction with at times showing a dark craft.,01/01/2023,03/06/2023,
https://nuforc.org/sighting/?id=173705,01/01/2023 16:45,Clovis,NM,USA,Cigar,Cigar shape bobbed in & out of clouds in place.,01/02/2023,03/06/2023,
https://nuforc.org/sighting/?id=173977,01/01/2023 12:00,Roanoke,VA,USA,Unknown,Red bell moving in jerky almost as u would move a laser pointer.,01/18/2023,03/06/2023,
https://nuforc.org/sighting/?id=173673,01/01/2023 10:56,Los Angeles,CA,USA,Circle,Saw a fast moving disc when coming into land at LAX airport,01/01/2023,03/06/2023,
https://nuforc.org/sighting/?id=173674,01/01/2023 09:48,Marfa,TX,USA,Other,Random white structure in the sky- not moving at all,01/01/2023,03/06/2023,Y
https://nuforc.org/sighting/?id=173906,01/01/2023 07:01,North Myrtle Beach,SC,USA,Cylinder,Seen just before sunrise on New Year's Day,01/14/2023,03/06/2023,Y
https://nuforc.org/sighting/?id=173680,01/01/2023 05:05,Pendleton,OR,USA,Light,Orange light hovering and maybe very slowly floating to the North.,01/01/2023,03/06/2023,Y
https://nuforc.org/sighting/?id=173707,01/01/2023 02:06,Plano,TX,USA,Light,My friend and I were sitting in her car saw this bright orange glowing thing very quick and steady fly over us.,01/03/2023,03/06/2023,
https://nuforc.org/sighting/?id=174475,01/01/2023 01:30,Port Charlotte,FL,USA,Triangle,I have never seen anything like this before and no noise,02/12/2023,03/06/2023,Y
https://nuforc.org/sighting/?id=173660,01/01/2023 00:45,North Chesterfield,VA,USA,Formation,Two lights moving together in formation at fast speed,12/31/2022,03/06/2023,
https://nuforc.org/sighting/?id=173668,01/01/2023 00:30,Hyattsville,MD,USA,Triangle,Triangle formation,01/01/2023,03/06/2023,
https://nuforc.org/sighting/?id=173675,01/01/2023 00:30,Waialua,HI,USA,Formation,Numerous greenish twinkling stars in a swarm slowing drifting over ocean.,01/01/2023,03/06/2023,
https://nuforc.org/sighting/?id=173688,01/01/2023 00:30,Houston,TX,USA,Rectangle,Four objects flying over neighborhood,01/01/2023,03/06/2023,Y
https://nuforc.org/sighting/?id=173671,01/01/2023 00:03,Roma,TX,USA,Fireball,"A series of fireballs in different sequence, that lasted over a series of minutes",01/01/2023,03/06/2023,Y
https://nuforc.org/sighting/?id=173717,01/01/2023 00:03,Warm Springs,OR,USA,Disk,Security Camera Footage,01/03/2023,03/06/2023,
