details,date,city,state,country,shape,summary,report_date,posted_date,image
https://nuforc.org/sighting/?id=176638,07/07/2023 12:36,Proctor,VT,USA,Flash,"1 30-sec orange glow in driveway seen through blinds around 0330, then orange flash (orb shape?) by the ceiling a few minutes ago.",07/07/2023,07/10/2023,
https://nuforc.org/sighting/?id=176627,07/07/2023 12:19,Bamber Bridge,Lancashire,United Kingdom,Circle,"Looked like a aeroplane, but extreme bright with no other lights only white",07/06/2023,07/10/2023,
https://nuforc.org/sighting/?id=176830,07/07/2023 07:50,Oakwood,IL,USA,Cube,Double cube,07/18/2023,07/29/2023,Y
https://nuforc.org/sighting/?id=176631,07/06/2023 22:12,Forest City,NC,USA,Orb,Saw orange orb in backyard.,07/06/2023,07/10/2023,
https://nuforc.org/sighting/?id=176656,07/06/2023 22:00,Blaine,MN,USA,Circle,Moving ball of light.,07/08/2023,07/10/2023,
https://nuforc.org/sighting/?id=177224,07/06/2023 21:40,Dekalb,IL,USA,Formation,Changed color shape and location fast and then disappeared,07/30/2023,09/10/2023,Y
https://nuforc.org/sighting/?id=176634,07/06/2023 11:00,Spokane Valley,WA,USA,Other,4 large exhaust engines and a very large craft,07/06/2023,07/10/2023,
https://nuforc.org/sighting/?id=176620,07/06/2023 07:50,Pottstown,PA,USA,Circle,JBU555 pilots reported fast flying object 4-5 thousand feet above,07/06/2023,07/10/2023,
https://nuforc.org/sighting/?id=176614,07/05/2023 23:38,Reno,OH,USA,Light,Rapidly moving bright light curved and faded into nothing,07/05/2023,07/10/2023,
https://nuforc.org/sighting/?id=176616,07/05/2023 23:20,Boise,ID,USA,Formation,V shaped formation very silent,07/05/2023,07/10/2023,
https://nuforc.org/sighting/?id=176621,07/05/2023 23:00,Milton,VT,USA,Cylinder,"11pm, looking to the sky, the most brilliant thing I've ever seen.",07/06/2023,07/10/2023,
https://nuforc.org/sighting/?id=176617,07/05/2023 21:50,Concord,CA,USA,Light,The first one moved and changed directions at incredible speed,07/05/2023,07/10/2023,
https://nuforc.org/sighting/?id=176702,07/05/2023 21:40,Pine Bluff,AR,USA,Oval,UFO Spotted Due N,07/11/2023,07/29/2023,Y
https://nuforc.org/sighting/?id=176699,07/05/2023 20:59,Emerald Isle,NC,USA,Orb,Small orange orb seen moving slowly at low altitude.,07/11/2023,07/29/2023,Y
https://nuforc.org/sighting/?id=176632,07/05/2023 20:25,Boston,MA,USA,Circle,Flying low there's two spheres one on top of the other. They go sideways and upwards towards the sky. In the end they take off quickly,07/06/2023,07/10/2023,Y
https://nuforc.org/sighting/?id=176605,07/05/2023 13:16,San Jacinto,CA,USA,Light,Round bright light moving back and forth in the sky changing direction before moving toward the mountain descended & disappeared,07/05/2023,07/10/2023,
https://nuforc.org/sighting/?id=176799,07/05/2023 10:45,Canal Winchester,OH,USA,Changing,Saw what appeared to be a large round ball in the sky that became elongated,07/16/2023,07/29/2023,Y
https://nuforc.org/sighting/?id=176612,07/05/2023 10:45,Bad axe,MI,USA,Triangle,The sound was identical to the sound I heard during the recent UFO sighting in Bad Axe that made newspaper headlines.,07/05/2023,07/10/2023,Y
https://nuforc.org/sighting/?id=176595,07/05/2023 09:15,Ocean springs,MS,USA,Cylinder,Long silver reflective cylinder moving south,07/05/2023,07/10/2023,
https://nuforc.org/sighting/?id=176598,07/05/2023 07:38,Grand Prarie,TX,USA,Sphere,"Sunny clear blue skies. Object was extremely high due to the small size, I assumed. It reflected 2 times for a few seconds",07/05/2023,07/10/2023,
https://nuforc.org/sighting/?id=176587,07/04/2023 23:40,Cheektowaga,NY,USA,Light,2 bright yellow orange lights traversing south to north slowly climbing then disappeared,07/04/2023,07/10/2023,
https://nuforc.org/sighting/?id=176599,07/04/2023 23:30,Tacoma,WA,USA,Circle,Flashing light that turned red with a green blinking light then would turn blue and moved fast and would disappear and reappear.,07/05/2023,07/10/2023,Y
https://nuforc.org/sighting/?id=177089,07/04/2023 23:00,Cheshire,CT,USA,Disk,I was sitting on veranda when I saw light over the tree I initially thought it was fireworks.,07/28/2023,07/29/2023,
https://nuforc.org/sighting/?id=176842,07/04/2023 23:00,cheshire,CT,USA,Disk,A charcoal gray saucer the size of a football field was above the trees right in front of me...it had 3 large lights/windows and,07/19/2023,07/29/2023,
https://nuforc.org/sighting/?id=176604,07/04/2023 22:33,Westland,MI,USA,Changing,UFO over Wayne Michigan,07/05/2023,07/10/2023,
https://nuforc.org/sighting/?id=176652,07/04/2023 22:30,Red Bluff,CA,USA,Star,"Three ‘dull-like stars moving slowly to form a triangle, then 22 more appeared.",07/09/2023,07/10/2023,
https://nuforc.org/sighting/?id=176586,07/04/2023 22:19,Macomb,MI,USA,Light,"Fast moving object in the sky. Red and green lighting. Another object came out of it, same description.",07/04/2023,07/10/2023,Y
https://nuforc.org/sighting/?id=176630,07/04/2023 22:12,Mount Holly springs,PA,USA,Other,"My fiance was at her mother's house ,she noticed this in the night sky it was not the moon .",07/06/2023,07/10/2023,
https://nuforc.org/sighting/?id=176590,07/04/2023 22:00,Gresham,OR,USA,Star,Line of evenly spaced stars moving south to north at least 1000ft or more. They suddenly stopped and changed patern and directions,07/05/2023,07/10/2023,
https://nuforc.org/sighting/?id=176603,07/04/2023 22:00,Spokane,WA,USA,Rectangle,"Craft and orb watch the fireworks, defy laws of nature, then go their separate ways, then suddenly dissappear.",07/05/2023,07/10/2023,
https://nuforc.org/sighting/?id=176611,07/04/2023 21:38,Fresno,CA,USA,Orb,Green oval shape object hovering and moving around around 15 minutes.,07/05/2023,07/10/2023,Y
https://nuforc.org/sighting/?id=176921,07/04/2023 21:35,Brooklyn,NY,USA,Light,White Light!,07/23/2023,07/29/2023,Y
https://nuforc.org/sighting/?id=176601,07/04/2023 21:35,Brunswick,MD,USA,Formation,Quick moving lights in synchronization. No sound or trails. Disappeared and reapeard on walk to apartment. Objects changed colors a lot,07/05/2023,07/10/2023,Y
https://nuforc.org/sighting/?id=176583,07/04/2023 21:33,Isiolo,,Kenya,Formation,Brighter than the full moon but small descending oddly fast,07/04/2023,07/10/2023,Y
https://nuforc.org/sighting/?id=176579,07/04/2023 21:30,reno,NV,USA,Light,Gradient circular changing colors of light with random spurts of faded white behind cloud and moving with it.,07/04/2023,07/10/2023,
https://nuforc.org/sighting/?id=176600,07/04/2023 21:30,Tucson,AZ,USA,Unknown,"Hovering craft with flashing lights which then silently zipped due east, out of sight.",07/05/2023,07/10/2023,
https://nuforc.org/sighting/?id=176629,07/04/2023 21:25,Mission Viejo,CA,USA,Rectangle,Large panel glowing blue,07/06/2023,07/10/2023,
https://nuforc.org/sighting/?id=176589,07/04/2023 21:21,El Paso,TX,USA,Changing,Video of it speeding up and changing shapes,07/04/2023,07/10/2023,Y
https://nuforc.org/sighting/?id=176594,07/04/2023 21:14,Pirtsmouth,VA,USA,Circle,I saw a cataract like anomaly in the sky. It was still for a while and then slowly dropped from the sky.,07/05/2023,07/10/2023,Y
https://nuforc.org/sighting/?id=176682,07/04/2023 21:00,Mission Viejo,CA,USA,Light,"Red light and flashing green light moving rapidly across the sky too fast for a plane, and behaving unusually.",07/10/2023,07/29/2023,Y
https://nuforc.org/sighting/?id=176608,07/04/2023 21:00,Columbia,NC,USA,Light,Green blinking light made 6 erratic moves at great distances which appeared to be at supersonic speed,07/05/2023,07/10/2023,
https://nuforc.org/sighting/?id=176602,07/04/2023 20:50,Waynesville,MO,USA,Changing,I was driving eastward on Old Route 66 and I saw a orange/golden color in my left peripheral. That’s when I looked and took photos,07/05/2023,07/10/2023,Y
https://nuforc.org/sighting/?id=176623,07/04/2023 20:47,Pelham,NY,USA,Other,"While waiting for a 4th of July fireworks display to begin, I and 3 friends noticed a blinking green, sometimes red, light in the sky.",07/06/2023,07/10/2023,Y
https://nuforc.org/sighting/?id=176679,07/04/2023 20:45,Edmonton,AB,Canada,Other,"Object witnessed, Edmonton AB, July 4 2023",07/10/2023,07/29/2023,Y
https://nuforc.org/sighting/?id=176626,07/04/2023 18:30,Orange,VA,USA,Orb,"My wife and I looked out of the window and saw the 5 lights not moving spaced 10ft apart, went to grab mytelescope and they disappeared",07/06/2023,07/10/2023,Y
https://nuforc.org/sighting/?id=176593,07/04/2023 08:55,sarasota,FL,USA,Circle,This object was in front of the clouds ands burning bright yellow /orange with a standing aurora around it,07/05/2023,07/10/2023,Y
https://nuforc.org/sighting/?id=176578,07/03/2023 23:00,Lincoln,NE,USA,Chevron,Was the coolest technology I’ve ever seen it was translucent & reflected the smoke above it from fireworks on the bttm and the stars,07/03/2023,07/10/2023,
https://nuforc.org/sighting/?id=177957,07/03/2023 22:35,Burke Mountain (viewed from; over Surrey/White Rock),BC,Canada,Fireball,While driving home I noticed the light shining way way brighter than any airplane or star. Airplanes flying past looked tiny compared,09/01/2023,09/10/2023,Y
https://nuforc.org/sighting/?id=176581,07/03/2023 22:10,Knoxville,TN,USA,Orb,"White strobe-like light moving at very high speed with instant acceleration and deceleration, with instant 90 degree turns.",07/04/2023,07/10/2023,
https://nuforc.org/sighting/?id=176577,07/03/2023 21:50,Jackson,WI,USA,Orb,Multiple silver orbs appearing and disappearing in the same small area of sky,07/03/2023,07/10/2023,
https://nuforc.org/sighting/?id=176582,07/03/2023 21:48,Bellevue,WA,USA,Changing,Object(s) in the Sky,07/04/2023,07/10/2023,Y
https://nuforc.org/sighting/?id=176576,07/03/2023 21:20,Justice,IL,USA,Light,I was sitting on my steps watching a fireworks show that started 3 minutes before I see a red orb coming towards me.,07/03/2023,07/10/2023,
https://nuforc.org/sighting/?id=176639,07/03/2023 20:42,Phoenix,AZ,USA,Star,Starlike UFO drops a mysterious teardrop object before vanishing into thin air.,07/07/2023,07/10/2023,Y
https://nuforc.org/sighting/?id=177908,07/03/2023 18:00,Toledo,OH,USA,Circle,Saw UAP fly over house,08/28/2023,09/10/2023,
https://nuforc.org/sighting/?id=177028,07/03/2023 12:20,Lava Hot Springs,ID,USA,Orb,I saw a cluster of metallic orbs that were 10 plus in numbers and two individual metallic orbs.,07/26/2023,07/29/2023,Y
https://nuforc.org/sighting/?id=176570,07/03/2023 10:26,Timnath,CO,USA,Sphere,Three objects that seemed to move in concert or were connected as one. Right over highway.,07/03/2023,07/10/2023,Y
https://nuforc.org/sighting/?id=176563,07/03/2023 05:04,NYC,NY,USA,Disk,I was videotaping Central Park and 2 orbs appeared and disappeared,07/03/2023,07/10/2023,Y
https://nuforc.org/sighting/?id=176573,07/03/2023 03:45,Portland,OR,USA,Sphere,"Saw it at about 20-30k feet. It was a “go fast “, blurry, soft light.",07/03/2023,07/10/2023,
https://nuforc.org/sighting/?id=176615,07/03/2023 01:30,Monroe,WA,USA,Light,"Very bright star-like object, about the size of Venus, but much brighter, moving very fast",07/05/2023,07/10/2023,
https://nuforc.org/sighting/?id=176566,07/02/2023 21:45,Elizabethtown,PA,USA,Light,A short creature with big black shiny eyes ran from my shed back behind my car and then green lights flashed and it was gone.,07/03/2023,07/10/2023,Y
https://nuforc.org/sighting/?id=176572,07/02/2023 21:40,Rapid City,SD,USA,Light,We saw round 3 lights moving through the sky above our area two of which performed movements an airplane could not.,07/03/2023,07/10/2023,
https://nuforc.org/sighting/?id=176558,07/02/2023 21:35,Vandergrift,PA,USA,Orb,I took a video of it,07/02/2023,07/10/2023,Y
https://nuforc.org/sighting/?id=176574,07/02/2023 21:30,St. George,UT,USA,Disk,"Flashing red, green and white lights",07/03/2023,07/10/2023,Y
https://nuforc.org/sighting/?id=176761,07/02/2023 21:25,North cape may,NJ,USA,Disk,Was at the bay at night watching a thunder storm when a craft zoomed right in front of us then right over us. I went to the ground.,07/14/2023,07/29/2023,
https://nuforc.org/sighting/?id=176618,07/02/2023 19:05,Montgomeryville,PA,USA,Sphere,"Pre-tornado: One with a trail far away, one floating much closer",07/06/2023,07/10/2023,
https://nuforc.org/sighting/?id=176559,07/02/2023 13:34,Abo ruins near Belen,NM,USA,Circle,At ruins. It was silent. no emissions . Disappeared,07/02/2023,07/10/2023,Y
https://nuforc.org/sighting/?id=176546,07/02/2023 01:26,Ashford,Kent,United Kingdom,Star,Flashing light changing direction,07/01/2023,07/10/2023,
https://nuforc.org/sighting/?id=176569,07/02/2023 01:19,Coalinga,CA,USA,Other,We were driving through I5 when a craft appeared on drivers side then flew past windshield then on the left side with 3 bright lights.,07/03/2023,07/10/2023,Y
https://nuforc.org/sighting/?id=176549,07/01/2023 23:23,"Avenal, CA",CA,USA,Rectangle,"Flat object moved in interesting pattern, transparent object with no sound, disappearance, reappearance, capture on video",07/02/2023,07/10/2023,Y
https://nuforc.org/sighting/?id=177097,07/01/2023 22:42,Quincy,IL,USA,Circle,It flew so low in made a hum that made my eyes hurt it shot past so low to the point the trees blew from the wind I saw one big light,07/28/2023,07/29/2023,
https://nuforc.org/sighting/?id=176597,07/01/2023 21:57,Eden Prairie,MN,USA,Cigar,Craft moved at high speed traveling south directly at my House and camera them made an abrupt turn to the west.,07/05/2023,07/10/2023,Y
https://nuforc.org/sighting/?id=176562,07/01/2023 21:33,Shenandoah,VA,USA,Cigar,"Recording neighbors fireworks and a green light cut across the sky, saw it with my naked eye too just wasnt sure what it was right away",07/03/2023,07/10/2023,Y
https://nuforc.org/sighting/?id=176560,07/01/2023 21:13,West Orange,NJ,USA,Formation,We saw glowing white lights overhead in a V formation floating by silently.,07/02/2023,07/10/2023,Y
https://nuforc.org/sighting/?id=176580,07/01/2023 21:12,Woodridge,IL,USA,Orb,It was like fire in the sky.,07/04/2023,07/10/2023,Y
https://nuforc.org/sighting/?id=176540,07/01/2023 20:57,Milford,IA,USA,Circle,"Not moving, from what we can tell - or perhaps very slowly - silver or white, reflecting light",07/01/2023,07/10/2023,Y
https://nuforc.org/sighting/?id=176554,07/01/2023 20:50,Marion,IL,USA,Orb,While doing runway inspections spotted craft moving horizontally then upward into clouds. No air traffic on local freq or on ADSB,07/02/2023,07/10/2023,Y
https://nuforc.org/sighting/?id=178074,07/01/2023 19:08,Denver,CO,USA,Orb,Silent Metallic Orange Orb silently hovering at low altitude over Denver,09/05/2023,09/10/2023,
https://nuforc.org/sighting/?id=176778,07/01/2023 17:40,"31.997470, 44.353483",Najaf Governorate,Iraq,Light,"5 luminous objects landed, one of them descended, and the rest remained flying, then the fifth joined the four and set off into the sky",07/15/2023,07/29/2023,
https://nuforc.org/sighting/?id=176545,07/01/2023 11:30,Warsaw,KY,USA,Disk,Taking photos of damage after storm notice UFO in picture different locations,07/01/2023,07/10/2023,Y
https://nuforc.org/sighting/?id=176565,07/01/2023 10:09,Bogotá,Cundinamarca Department,Colombia,Triangle,Something happened while I was looking at the moon with a telescope,07/03/2023,07/10/2023,Y
https://nuforc.org/sighting/?id=176539,07/01/2023 03:30,Approx. 2.5 NM off coast of Sloop Point,NJ,USA,Cube,Pulled alongside my boat. I was afraid I was going to hit it. Stayed about 20 feet and hovered just off surface.,07/01/2023,07/10/2023,
https://nuforc.org/sighting/?id=176532,07/01/2023 00:07,Killiney,County Dublin,Ireland,Oval,2 to 3 lighting fast light moves just at elevated cloud level,06/30/2023,07/10/2023,Y
https://nuforc.org/sighting/?id=176539,07/01/2023 03:30,Approx. 2.5 NM off coast of Sloop Point,NJ,USA,Cube,Pulled alongside my boat. I was afraid I was going to hit it. Stayed about 20 feet and hovered just off surface.,07/01/2023,07/10/2023,
https://nuforc.org/sighting/?id=176532,07/01/2023 00:07,Killiney,County Dublin,Ireland,Oval,2 to 3 lighting fast light moves just at elevated cloud level,06/30/2023,07/10/2023,Y
